,codigo_centro,codigo_titulacion,nombre_titulacion,porcentaje_abandono,numero_abandonos,numero_matriculados,anyo,duracion_carrera
884,26,526,grado en enfermeria,0.17647058823529413,12.0,68.0,2017,
885,28,527,grado en enfermeria,0.19480519480519481,15.0,77.0,2017,
886,28,528,grado en finanzas y contabilidad,0.41025641025641024,16.0,39.0,2017,
887,28,529,grado en relaciones laborales y recursos humanos,0.32432432432432434,12.0,37.0,2017,
888,148,531,grado en enfermeria,0.109375,7.0,64.0,2017,
889,38,532,grado en turismo,0.3157894736842105,6.0,19.0,2017,
890,38,537,grado en publicidad y relaciones publicas,0.15555555555555556,7.0,45.0,2017,
891,38,538,grado en periodismo,0.3157894736842105,12.0,38.0,2017,
892,38,539,grado en comunicacion audiovisual,0.2391304347826087,11.0,46.0,2017,
893,28,541,grado en educacion primaria,0.24444444444444444,11.0,45.0,2017,
894,28,542,grado en fisioterapia,0.2982456140350877,17.0,57.0,2017,
895,28,544,grado en educacion infantil,0.1282051282051282,5.0,39.0,2017,
896,28,m547,mu en profesorado de eso bachiller fp y enseñanzas de idiomas  ,0.0,0.0,100.0,2017,
897,1,151,grado en administracion y direccion de empresas,0.3621013133208255,193.0,533.0,2016,4.0
898,5,153,grado en biologia,0.19831223628691982,47.0,237.0,2016,4.0
899,18,154,grado en ciencias de la actividad fisica y del deporte,0.07936507936507936,5.0,63.0,2016,4.0
900,20,155,grado en derecho,0.128060263653484,68.0,531.0,2016,4.0
901,1,156,grado en economia,0.1791044776119403,24.0,134.0,2016,4.0
902,11,157,grado en enfermeria,0.12340425531914893,29.0,235.0,2016,4.0
903,19,158,grado en farmacia,0.14527027027027026,43.0,296.0,2016,4.0
904,16,159,grado en filologia hispanica,0.34234234234234234,38.0,111.0,2016,4.0
905,12,160,grado en filosofia,0.36904761904761907,31.0,84.0,2016,4.0
906,7,161,grado en finanzas y contabilidad,0.4196078431372549,214.0,510.0,2016,4.0
907,6,162,grado en fisica,0.41414141414141414,41.0,99.0,2016,4.0
908,11,163,grado en fisioterapia,0.1717171717171717,17.0,99.0,2016,4.0
909,4,164,grado en geografia y gestion del territorio,0.23214285714285715,13.0,56.0,2016,4.0
910,20,165,grado en gestion y administracion publica,0.2828282828282828,28.0,99.0,2016,4.0
911,4,166,grado en historia,0.3407821229050279,61.0,179.0,2016,4.0
912,4,167,grado en historia del arte,0.3551912568306011,65.0,183.0,2016,4.0
913,17,171,grado en matematicas,0.41007194244604317,57.0,139.0,2016,6.0
914,14,172,grado en medicina,0.09289617486338798,34.0,366.0,2016,5.0
915,10,173,grado en odontologia,0.23655913978494625,22.0,93.0,2016,4.0
916,18,174,grado en pedagogia,0.11353711790393013,26.0,229.0,2016,4.0
917,11,175,grado en podologia,0.27941176470588236,19.0,68.0,2016,4.0
918,13,176,grado en psicologia,0.11379310344827587,33.0,290.0,2016,4.0
919,22,177,grado en quimica,0.2080536912751678,31.0,149.0,2016,4.0
920,8,178,grado en relaciones laborales y recursos humanos,0.19827586206896552,46.0,232.0,2016,4.0
921,7,179,grado en turismo,0.23708206686930092,78.0,329.0,2016,4.0
922,1,180,grado en marketing e investigacion de mercados,0.408,51.0,125.0,2016,4.0
923,16,181,grado en estudios arabes e islamicos,0.42857142857142855,21.0,49.0,2016,4.0
924,16,182,grado en estudios franceses,0.44285714285714284,31.0,70.0,2016,4.0
925,16,183,grado en estudios ingleses,0.28654970760233917,49.0,171.0,2016,4.0
926,16,184,grado en filologia clasica,0.6521739130434783,30.0,46.0,2016,4.0
927,16,185,grado en lengua y literatura alemanas,0.42857142857142855,15.0,35.0,2016,4.0
928,4,188,grado en antropologia social y cultural,0.3620689655172414,21.0,58.0,2016,4.0
929,21,190,grado en bellas artes,0.17391304347826086,32.0,184.0,2016,4.0
930,2,192,grado en comunicacion audiovisual,0.15492957746478872,22.0,142.0,2016,4.0
931,21,193,grado en conservacion y restauracion de bienes culturales,0.3114754098360656,19.0,61.0,2016,4.0
932,18,194,grado en educacion infantil,0.05909090909090909,13.0,220.0,2016,4.0
933,18,195,grado en educacion primaria,0.12417218543046357,75.0,604.0,2016,4.0
934,17,196,grado en estadistica,0.5,17.0,34.0,2016,4.0
935,45,197,grado en ingenieria aeroespacial,0.171875,22.0,128.0,2016,4.0
936,9,198,grado en ingenieria agricola,0.43272727272727274,119.0,275.0,2016,4.0
937,45,199,grado en ingenieria de las tecnologias de telecomunicacion,0.3068181818181818,54.0,176.0,2016,4.0
938,23,200,grado en ingenieria electrica,0.4146341463414634,34.0,82.0,2016,4.0
939,23,201,grado en ingenieria electronica industrial,0.4676258992805755,65.0,139.0,2016,4.0
940,23,202,grado en ingenieria en diseño industrial y desarrollo del producto,0.35294117647058826,48.0,136.0,2016,4.0
941,45,203,grado en ingenieria de tecnologias industriales,0.15867158671586715,43.0,271.0,2016,4.0
942,3,204,grado en ingenieria informatica-ingenieria de computadores,0.73,73.0,100.0,2016,4.0
943,3,205,grado en ingenieria informatica-ingenieria del software,0.35185185185185186,76.0,216.0,2016,4.0
944,3,206,grado en ingenieria informatica-tecnologias informaticas,0.6690140845070423,95.0,142.0,2016,4.0
945,23,207,grado en ingenieria mecanica,0.35403726708074534,57.0,161.0,2016,4.0
946,45,208,grado en ingenieria quimica,0.4430379746835443,35.0,79.0,2016,4.0
947,23,209,grado en ingenieria quimica industrial,0.37037037037037035,30.0,81.0,2016,4.0
948,2,210,grado en periodismo,0.08363636363636363,23.0,275.0,2016,4.0
949,2,211,grado en publicidad y relaciones publicas,0.09154929577464789,13.0,142.0,2016,4.0
950,14,217,grado en biomedicina basica y experimental,0.24489795918367346,12.0,49.0,2016,4.0
951,20,218,grado en criminologia,0.10344827586206896,6.0,58.0,2016,4.0
952,12,219,grado en estudios de asia oriental,0.19642857142857142,11.0,56.0,2016,4.0
953,40,221,grado en ingenieria de la energia,0.16901408450704225,12.0,71.0,2016,4.0
954,6,222,grado en ingenieria de materiales,0.26666666666666666,12.0,45.0,2016,1.0
955,19,223,grado en optica y optometria,0.07692307692307693,4.0,52.0,2016,1.0
956,5,224,grado en bioquimica por la u de sevilla y u de malaga,0.18,9.0,50.0,2016,1.0
957,45,225,grado en ingenieria civil,0.2,15.0,75.0,2016,1.0
958,3,226,grado en ingenieria de la salud,0.3230769230769231,21.0,65.0,2016,1.0
959,45,227,grado en ingenieria de organizacion industrial,0.28125,18.0,64.0,2016,1.0
960,45,228,grado en ingenieria electronica robotica y mecatronica,0.2857142857142857,18.0,63.0,2016,1.0
961,2,m036,mu en comunicacion y cultura (rd1393/07),0.0,0.0,19.0,2016,
962,302,m037,mu en artes del espectaculo vivo (rd1393/07),0.058823529411764705,1.0,17.0,2016,
963,302,m039,mu en estudios de genero y desarrollo profesional (rd07),0.08,2.0,25.0,2016,
964,15,m040,mu en peritacion y reparacion de edificios,0.1,2.0,20.0,2016,
965,13,m041,mu en psicologia de las organizaciones y del trabajo (07),0.047619047619047616,1.0,21.0,2016,
966,15,m043,mu en urbanismo planeamiento y diseño urbano ,0.25,2.0,8.0,2016,
967,302,m044,mu profesorado de eso y bachillerato f p y ede idiomas ,0.02564102564102564,11.0,429.0,2016,
968,302,m048,mu en gestion de las tec de la informacion y de las comu,0.0,0.0,12.0,2016,
969,18,m049,mu en actividad fisica y cdad de vida de perso adultas y mayo,0.16666666666666666,4.0,24.0,2016,
970,4,m050,mu en arqueologia (rd1393/07),0.08333333333333333,2.0,24.0,2016,
971,15,m051,mu en arquitectura y patrimonio historico (rd1393/07),0.023255813953488372,1.0,43.0,2016,
972,21,m052,mu en arte: idea y produccion (rd1393/07),0.08,2.0,25.0,2016,
973,302,m056,mu en ciencia y tecnologia de nuevos materiales (rd1393/07),0.23809523809523808,5.0,21.0,2016,
974,1,m060,mu en consultoria economica y analisis aplicado (rd1393/07),0.13043478260869565,3.0,23.0,2016,
975,20,m061,mu en derecho constitucional (rd1393/07),0.07692307692307693,1.0,13.0,2016,
976,20,m062,mu en derecho publico (rd1393/07),0.0,0.0,12.0,2016,
977,7,m063,mu en direccion y planificacion del turismo (rd1393/07),0.06896551724137931,2.0,29.0,2016,
978,18,m064,mu en direccion evaluacion y calidad de las instituciones de for,0.2692307692307692,7.0,26.0,2016,
979,23,m066,mu en instalaciones y diseño de productos (rd1393/07),0.2,2.0,10.0,2016,
980,4,m067,mu en documentos y libros archivos y bibliotecas ,0.10810810810810811,4.0,37.0,2016,
981,1,m068,mu en economia y desarrollo (rd1393/07),0.16666666666666666,3.0,18.0,2016,
982,16,m070,mu en endel español como l extranjera y de otras l modernas ,0.19047619047619047,8.0,42.0,2016,
983,2,m071,mu en escritura creativa (rd1393/07),0.043478260869565216,1.0,23.0,2016,
984,13,m073,mu en estudios avanzados en cerebro y conducta ,0.034482758620689655,1.0,29.0,2016,
985,1,m074,mu en estudios avanzados en direccion de empresas,0.3333333333333333,8.0,24.0,2016,
986,22,m075,mu en estudios avanzados en quimica (rd1393/07),0.1111111111111111,1.0,9.0,2016,
987,16,m076,mu en estudios hispanicos superiores (rd1393/07),0.1,3.0,30.0,2016,
988,6,m082,mu en fisica nuclear (master interuniversitario) (rd1393/07),0.375,3.0,8.0,2016,
989,302,m083,mu en fisiologia y neurociencia (rd1393/07),0.03571428571428571,1.0,28.0,2016,
990,1,m085,mu en gestion estrategica y negocios internacionales ,0.034482758620689655,1.0,29.0,2016,
991,98,m086,mu en gestion integral de la edificacion (rd1393/07),0.19047619047619047,4.0,21.0,2016,
992,8,m087,mu en gestion y desarrollo de recursos humanos,0.0,0.0,30.0,2016,
993,2,m088,mu en guion narrativa y creatividad audiovisual (rd1393/07),0.07142857142857142,2.0,28.0,2016,
994,3,m089,mu en ingenieria de computadores y redes (rd1393/07),0.0,0.0,6.0,2016,
995,3,m090,mu en ingenieria y tecnologia del software (rd1393/07),0.1111111111111111,2.0,18.0,2016,
996,13,m092,mu en intervencion y mediacion familiar (rd1393/07),0.06666666666666667,2.0,30.0,2016,
997,3,m095,mu en logica computacion e inteligencia artificial ,0.2727272727272727,3.0,11.0,2016,
998,6,m099,mu en microelectronica: dño y appsde sistemas m/nano,0.4666666666666667,7.0,15.0,2016,
999,11,m100,mu en nuevas tendencias asistenciales en ciencias de la salud,0.20512820512820512,8.0,39.0,2016,
1000,4,m103,mu en patrimonio artistico andaluz y su proy iberoamericana ,0.06666666666666667,1.0,15.0,2016,
1001,13,m104,mu en psi de la edu avances en inter psicoedu y ne esp,0.0,0.0,35.0,2016,
1002,13,m105,mu en psicologia de la intervencion social y comunitaria,0.02702702702702703,1.0,37.0,2016,
1003,20,m106,mu en relaciones juridico-privadas (rd1393/07),0.1111111111111111,2.0,18.0,2016,
1004,98,m107,mu en seguridad integral en edificacion (rd1393/07),0.16666666666666666,3.0,18.0,2016,
1005,23,m108,mu en seguridad integral en la industria y prev rrll,0.05714285714285714,2.0,35.0,2016,
1006,16,m112,mu en traduccion e interculturalidad (rd1393/07),0.0625,1.0,16.0,2016,
1007,8,m113,mu en ciencias del trabajo (rd1393/2007),0.375,3.0,8.0,2016,
1008,2,m114,mu en comunicacion institucional y politica (rd1393/2007),0.11538461538461539,3.0,26.0,2016,
1009,12,m115,mu en filosofia y cultura moderna (rd1393/2007),0.05263157894736842,1.0,19.0,2016,
1010,4,m117,mu en antropologia: gestion de la diver cul el patr y el des ,0.2222222222222222,4.0,18.0,2016,
1011,4,m121,mu en estudios americanos (rd1393/2007),0.045454545454545456,1.0,22.0,2016,
1012,20,m122,mu en abogacia (rd 1393/2007),0.011764705882352941,1.0,85.0,2016,
1013,20,m123,mu en asesoria juridico-mercantil fiscal y laboral ,0.20833333333333334,5.0,24.0,2016,
1014,8,m125,mu en consultoria laboral,0.06666666666666667,2.0,30.0,2016,
1015,302,m126,mu en estudios europeos (2012) rd 1393/2007,0.06666666666666667,1.0,15.0,2016,
1016,14,m127,mu en investigacion medica: clinica y experimental ,0.17647058823529413,3.0,17.0,2016,
1017,13,m133,mu en migraciones internacionales salud y bienestar: modelos y estrategias de intervencion,0.0,0.0,5.0,2016,
1018,19,m134,mu en especializacion profesional en farmacia,0.10256410256410256,4.0,39.0,2016,
1019,4,m135,m u en estudios historicos avanzados,0.12121212121212122,4.0,33.0,2016,
1020,5,m136,mu en biologia avanzada: investigacion y aplicacion,0.037037037037037035,1.0,27.0,2016,
1021,16,m137,mu en estudios lingüisticos literarios y culturales por la us,0.11538461538461539,3.0,26.0,2016,
1022,18,m138,mu en psicopedagogia,0.0,0.0,59.0,2016,
1023,18,m139,mu en neceducespecy atena la divad en la escuela por la us ,0.0,0.0,30.0,2016,
1024,13,m141,mu en psicologia general sanitaria por la universidad de sevilla,0.0,0.0,39.0,2016,
1025,45,m142,mu en ingenieria de telecomunicacion por la u de sevilla ,0.0,0.0,14.0,2016,
1026,45,m143,mu en ingenieria aeronautica por la universidad de sevilla ,0.03225806451612903,1.0,31.0,2016,
1027,45,m144,mu en ingenieria quimica por la universidad de sevilla,0.0,0.0,10.0,2016,
1028,45,m145,mu en ingenieria de caminos canales y puertos por la u s,0.16279069767441862,7.0,43.0,2016,
1029,45,m146,mu en ingenieria industrial por la universidad de sevilla,0.05263157894736842,5.0,95.0,2016,
1030,3,m147,mu en ingenieria informatica,0.0,0.0,7.0,2016,
1031,23,m148,mu en tecnologia e industria alimentaria por la us,0.05714285714285714,2.0,35.0,2016,
1032,302,m149,mu en sist inteligentes en ener y transporte por la usy la um,0.1,1.0,10.0,2016,
1033,15,m153,mu en arquitectura ,0.0,0.0,23.0,2016,
1034,302,m161,master universitario en investigacion biomedica,0.0,0.0,38.0,2016,
1035,17,m162,master universitario en matematicas,0.0,0.0,9.0,2016,
1036,1,151,grado en administracion y direccion de empresas,0.3392156862745098,,,2015,4.0
1037,5,153,grado en biologia,0.15444015444015444,,,2015,4.0
1038,18,154,grado en ciencias de la actividad fisica y del deporte,0.11475409836065574,,,2015,4.0
1039,20,155,grado en derecho,0.17805383022774326,,,2015,4.0
1040,1,156,grado en economia,0.22784810126582278,,,2015,4.0
1041,11,157,grado en enfermeria,0.132,,,2015,4.0
1042,19,158,grado en farmacia,0.19230769230769232,,,2015,4.0
1043,16,159,grado en filologia hispanica,0.25663716814159293,,,2015,4.0
1044,12,160,grado en filosofia,0.2962962962962963,,,2015,4.0
1045,7,161,grado en finanzas y contabilidad,0.47435897435897434,,,2015,4.0
1046,6,162,grado en fisica,0.4,,,2015,4.0
1047,11,163,grado en fisioterapia,0.1414141414141414,,,2015,4.0
1048,4,164,grado en geografia y gestion del territorio,0.2542372881355932,,,2015,4.0
1049,20,165,grado en gestion y administracion publica,0.26666666666666666,,,2015,4.0
1050,4,166,grado en historia,0.25595238095238093,,,2015,4.0
1051,4,167,grado en historia del arte,0.31216931216931215,,,2015,4.0
1052,98,168,grado en ciencia y tecnologia de edificacion,0.26616915422885573,,,2015,6.0
1053,17,171,grado en matematicas,0.2727272727272727,,,2015,5.0
1054,14,172,grado en medicina,0.08333333333333333,,,2015,4.0
1055,10,173,grado en odontologia,0.10227272727272728,,,2015,4.0
1056,18,174,grado en pedagogia,0.1934156378600823,,,2015,4.0
1057,11,175,grado en podologia,0.1267605633802817,,,2015,4.0
1058,13,176,grado en psicologia,0.12944983818770225,,,2015,4.0
1059,22,177,grado en quimica,0.19402985074626866,,,2015,4.0
1060,8,178,grado en relaciones laborales y recursos humanos,0.18181818181818182,,,2015,4.0
1061,7,179,grado en turismo,0.1994219653179191,,,2015,4.0
1062,1,180,grado en marketing e investigacion de mercados,0.35772357723577236,,,2015,4.0
1063,16,181,grado en estudios arabes e islamicos,0.3103448275862069,,,2015,4.0
1064,16,182,grado en estudios franceses,0.37142857142857144,,,2015,4.0
1065,16,183,grado en estudios ingleses,0.25555555555555554,,,2015,4.0
1066,16,184,grado en filologia clasica,0.5,,,2015,4.0
1067,16,185,grado en lengua y literatura alemanas,0.325,,,2015,4.0
1068,4,188,grado en antropologia social y cultural,0.3684210526315789,,,2015,4.0
1069,21,190,grado en bellas artes,0.22702702702702704,,,2015,4.0
1070,2,192,grado en comunicacion audiovisual,0.11486486486486487,,,2015,4.0
1071,21,193,grado en conservacion y restauracion de bienes culturales,0.26229508196721313,,,2015,4.0
1072,18,194,grado en educacion infantil,0.08438818565400844,,,2015,4.0
1073,18,195,grado en educacion primaria,0.1141552511415525,,,2015,4.0
1074,17,196,grado en estadistica,0.41025641025641024,,,2015,4.0
1075,45,197,grado en ingenieria aeroespacial,0.07586206896551724,,,2015,4.0
1076,9,198,grado en ingenieria agricola,0.383399209486166,,,2015,4.0
1077,45,199,grado en ingenieria de las tecnologias de telecomunicacion,0.18981481481481483,,,2015,4.0
1078,23,200,grado en ingenieria electrica,0.3764705882352941,,,2015,4.0
1079,23,201,grado en ingenieria electronica industrial,0.47101449275362317,,,2015,4.0
1080,23,202,grado en ingenieria en diseño industrial y desarrollo del producto,0.2529411764705882,,,2015,4.0
1081,45,203,grado en ingenieria de tecnologias industriales,0.16708229426433915,,,2015,4.0
1082,3,204,grado en ingenieria informatica-ingenieria de computadores,0.5566037735849056,,,2015,4.0
1083,3,205,grado en ingenieria informatica-ingenieria del software,0.3333333333333333,,,2015,4.0
1084,3,206,grado en ingenieria informatica-tecnologias informaticas,0.5418994413407822,,,2015,4.0
1085,23,207,grado en ingenieria mecanica,0.30386740331491713,,,2015,4.0
1086,45,208,grado en ingenieria quimica,0.2127659574468085,,,2015,4.0
1087,23,209,grado en ingenieria quimica industrial,0.45454545454545453,,,2015,4.0
1088,2,210,grado en periodismo,0.12544802867383512,,,2015,4.0
1089,2,211,grado en publicidad y relaciones publicas,0.06802721088435375,,,2015,4.0
1090,14,217,grado en biomedicina basica y experimental,0.125,,,2015,4.0
1091,20,218,grado en criminologia,0.08196721311475409,,,2015,4.0
1092,12,219,grado en estudios de asia oriental por la unvde sevilla y la unvde malaga,0.15,,,2015,4.0
1093,45,221,grado en ingenieria de la energia por la un de sevilla y la un de malaga,0.203125,,,2015,4.0
1094,6,222,grado en ingenieria de materiales,0.4722222222222222,,,2015,
1095,19,223,grado en optica y optometria,0.2222222222222222,,,2015,
1096,5,224,grado en bioquimica por la universidad de sevilla y universidad de malaga,0.11538461538461539,,,2015,
1097,45,225,grado en ingenieria civil,0.1506849315068493,,,2015,
1098,3,226,grado en ingenieria de la salud por la univ de malaga y la univde sevilla,0.21311475409836064,,,2015,
1099,45,227,grado en ingenieria de organizacion industrial por la u malaga y usevilla,0.3103448275862069,,,2015,
1100,45,228,grado en ingenieria electronica robotica y mecatronica (uma-us),0.203125,,,2015,
1101,2,m036,m u en comunicacion y cultura,0.1,,,2015,
1102,302,m037,m u en artes del espectaculo vivo,0.1111111111111111,,,2015,
1103,302,m039,m u en estudios de genero y desarrollo profesional,0.125,,,2015,
1104,15,m040,m u en peritacion y reparacion de edificios,0.14285714285714285,,,2015,
1105,13,m041,m u en psicologia de las organizaciones y del trabajo,0.03333333333333333,,,2015,
1106,15,m042,m u en innovacion en arquitectura: tecnologia y diseño,0.19047619047619047,,,2015,
1107,15,m043,m u en urbanismo planeamiento y diseño urbano,0.18181818181818182,,,2015,
1108,302,m044,m u en profesorado de eso y bachillerato fp y eidiomas,0.014492753623188406,,,2015,
1109,302,m048,m u en gestion de las tecnologias de la informy de las com,0.0,,,2015,
1110,18,m049,m u en actividad fisica y calidad de vida de personas adul,0.08333333333333333,,,2015,
1111,4,m050,m u en arqueologia,0.1875,,,2015,
1112,15,m051,m u en arquitectura y patrimonio historico,0.05714285714285714,,,2015,
1113,21,m052,m u en arte: idea y produccion,0.03125,,,2015,
1114,45,m054,m u en automatica robotica y telematica,0.2,,,2015,
1115,302,m056,m u en ciencia y tecnologia de nuevos materiales,0.0,,,2015,
1116,10,m058,m u en ciencias odontologicas,0.0,,,2015,
1117,15,m059,m u en ciudad y arquitectura sostenibles,0.0,,,2015,
1118,1,m060,m u en consultoria economica y analisis aplicado,0.1,,,2015,
1119,20,m061,m u en derecho constitucional,0.10526315789473684,,,2015,
1120,20,m062,m u en derecho publico,0.06666666666666667,,,2015,
1121,7,m063,m u en direccion y planificacion del turismo,0.08,,,2015,
1122,18,m064,m u en direccion evaluacion y calidad de las instituc de for,0.09523809523809523,,,2015,
1123,45,m065,m u en diseño avanzado en ingenieria mecanica,0.22727272727272727,,,2015,
1124,23,m066,m u en instalaciones y diseño de productos,0.14285714285714285,,,2015,
1125,4,m067,m u en documentos y libros archivos y bibliotecas,0.0,,,2015,
1126,1,m068,m u en economia y desarrollo,0.18181818181818182,,,2015,
1127,45,m069,m u en electronica tratamiento de señal y comunicaciones,0.2727272727272727,,,2015,
1128,16,m070,m u en enseñanza del español como lengua extranjera y otras lengmod,0.0,,,2015,
1129,2,m071,m u en escritura creativa,0.13793103448275862,,,2015,
1130,13,m073,m u en estudios avanzados en cerebro y conducta,0.0,,,2015,
1131,1,m074,m u en estudios avanzados en direccion de empresas,0.16666666666666666,,,2015,
1132,22,m075,m u en estudios avanzados en quimica,0.0,,,2015,
1133,16,m076,m u en estudios hispanicos superiores,0.0,,,2015,
1134,6,m082,m u en fisica nuclear,0.0,,,2015,
1135,302,m083,m u en fisiologia y neurociencia,0.0,,,2015,
1136,1,m085,m u en gestion estrategica y negocios internacionales,0.10714285714285714,,,2015,
1137,98,m086,m u en gestion integral de la edificacion,0.23529411764705882,,,2015,
1138,8,m087,m u en gestion y desarrollo de recursos humanos,0.0,,,2015,
1139,2,m088,m u en guion narrativa y creatividad audiovisual,0.043478260869565216,,,2015,
1140,3,m089,m u en ingenieria de computadores y redes,0.09090909090909091,,,2015,
1141,3,m090,m u en ingenieria y tecnologia del software,0.25,,,2015,
1142,13,m092,m u en intervencion y mediacion familiar,0.0,,,2015,
1143,3,m095,m u en logica computacion e inteligencia artificial,0.14285714285714285,,,2015,
1144,6,m099,m u en microelectronica: diseño y aplicaciones de sistemas,0.45454545454545453,,,2015,
1145,11,m100,m u en nuevas tendencias asistenciales en cc de la salud,0.05128205128205128,,,2015,
1146,4,m101,m u en ordenacion y gestion del desarrollo territorial y local,0.0,,,2015,
1147,45,m102,m u en organizacion industrial y gestion de empresas,0.1111111111111111,,,2015,
1148,4,m103,m u en patrimonio artistico andaluz y su proyeccion iberoameric,0.05263157894736842,,,2015,
1149,13,m104,m u en psicologia de la educacion avances en intervencion,0.02857142857142857,,,2015,
1150,13,m105,m u en psicologia de la intervencion social y comunitaria,0.058823529411764705,,,2015,
1151,20,m106,m u en relaciones juridico-privadas,0.2222222222222222,,,2015,
1152,98,m107,m u en seguridad integral en edificacion,0.058823529411764705,,,2015,
1153,23,m108,m u en seguridad integral en la industria y prevencion riesgos laborales,0.11904761904761904,,,2015,
1154,45,m109,m u en sistemas de energia electrica,0.16666666666666666,,,2015,
1155,45,m110,m u en sistemas de energia termica,0.0,,,2015,
1156,45,m111,m u en ingenieria ambiental,0.06666666666666667,,,2015,
1157,16,m112,m u en traduccion e interculturalidad,0.05555555555555555,,,2015,
1158,8,m113,m u en ciencias del trabajo,0.0,,,2015,
1159,2,m114,m u en comunicacion institucional y politica,0.06451612903225806,,,2015,
1160,12,m115,m u en filosofia y cultura moderna,0.0,,,2015,
1161,18,m116,m u en formacion y orientacion profesional para el empleo,0.1111111111111111,,,2015,
1162,4,m117,m u en antropologia: gestion de la diversidad cultural el paty el des,0.0,,,2015,
1163,4,m121,m u en estudios americanos,0.04,,,2015,
1164,20,m122,m u en abogacia,0.10344827586206896,,,2015,
1165,20,m123,m u en asesoria juridico-mercantil fiscal y laboral,0.1875,,,2015,
1166,8,m125,m u en consultoria laboral,0.16666666666666666,,,2015,
1167,302,m126,m u en estudios europeos,0.0,,,2015,
1168,14,m127,m u en investigacion medica: clinica y experimental,0.0,,,2015,
1169,13,m133,m u en migraciones internacionales salud y bienestar: mod y est de inter,0.0,,,2015,
1170,19,m134,m u en especializacion profesional en farmacia,0.034482758620689655,,,2015,
1171,4,m135,m u en estudios historicos avanzados,0.10256410256410256,,,2015,
1172,5,m136,m u en biologia avanzada: investigacion y aplicacion,0.0,,,2015,
1173,16,m137,m u en estudios lingüisticos literarios y culturales,0.0625,,,2015,
1174,18,m138,m u en psicopedagogia,0.018518518518518517,,,2015,
1175,18,m139,m u en necesid educativas especiales y atencion a la diversen la escuela,0.0,,,2015,
1176,23,m148,m u en tecnologia e industria alimentaria,0.0,,,2015,
