,codigo_centro,codigo_titulacion,nombre_titulacion,porcentaje_abandono,numero_abandonos,numero_matriculados,anyo,duracion_carrera
592,11,163,grado en fisioterapia,0.24778761061946902,28.0,113.0,2018,4.0
593,4,164,grado en geografia y gestion del territorio,0.3,18.0,60.0,2018,4.0
594,4,166,grado en historia,0.3351063829787234,63.0,188.0,2018,4.0
595,4,167,grado en historia del arte,0.42934782608695654,79.0,184.0,2018,4.0
596,17,171,grado en matematicas,0.2647058823529412,36.0,136.0,2018,4.0
597,14,172,grado en medicina (12-13),0.10354223433242507,38.0,367.0,2018,4.0
598,10,173,grado en odontologia (13-14),0.21505376344086022,20.0,93.0,2018,4.0
599,18,174,grado en pedagogia,0.13142857142857142,23.0,175.0,2018,4.0
600,11,175,grado en podologia,0.25316455696202533,20.0,79.0,2018,4.0
601,13,176,grado en psicologia,0.13011152416356878,35.0,269.0,2018,4.0
602,22,177,grado en quimica,0.2662337662337662,41.0,154.0,2018,4.0
603,8,178,grado en relaciones laborales y recursos humanos,0.2556053811659193,57.0,223.0,2018,4.0
604,7,179,grado en turismo,0.2588996763754045,80.0,309.0,2018,4.0
605,1,180,grado en marketing e investigacion de mercados,0.30708661417322836,39.0,127.0,2018,4.0
606,16,181,grado en estudios arabes e islamicos,0.5517241379310345,16.0,29.0,2018,4.0
607,16,182,grado en estudios franceses,0.44776119402985076,30.0,67.0,2018,4.0
608,16,183,grado en estudios ingleses,0.33714285714285713,59.0,175.0,2018,4.0
609,16,184,grado en filologia clasica,0.5405405405405406,20.0,37.0,2018,4.0
610,16,185,grado en lengua y literatura alemanas,0.3157894736842105,18.0,57.0,2018,4.0
611,4,188,grado en antropologia social y cultural,0.3548387096774194,22.0,62.0,2018,4.0
612,21,190,grado en bellas artes,0.1891891891891892,35.0,185.0,2018,4.0
613,2,192,grado en comunicacion audiovisual,0.1,15.0,150.0,2018,4.0
614,21,193,grado en conservacion y restauracion de bienes culturales,0.2318840579710145,16.0,69.0,2018,4.0
615,18,194,grado en educacion infantil,0.056818181818181816,10.0,176.0,2018,4.0
616,18,195,grado en educacion primaria,0.13333333333333333,76.0,570.0,2018,4.0
617,17,196,grado en estadistica,0.3111111111111111,14.0,45.0,2018,4.0
618,45,197,grado en ingenieria aeroespacial,0.15503875968992248,20.0,129.0,2018,4.0
619,9,198,grado en ingenieria agricola,0.460431654676259,128.0,278.0,2018,4.0
620,45,199,grado en ingenieria de las tecnologias de telecomunicacion,0.39869281045751637,61.0,153.0,2018,4.0
621,23,200,grado en ingenieria electrica,0.31496062992125984,40.0,127.0,2018,4.0
622,23,201,grado en ingenieria electronica industrial,0.35555555555555557,64.0,180.0,2018,4.0
623,23,202,grado en ingenieria en diseño industrial y desarrollo del producto,0.2597402597402597,40.0,154.0,2018,4.0
624,45,203,grado en ingenieria de tecnologias industriales,0.17054263565891473,44.0,258.0,2018,4.0
625,3,204,grado en ingenieria informatica-ingenieria de computadores,0.6277372262773723,86.0,137.0,2018,4.0
626,3,205,grado en ingenieria informatica-ingenieria del software,0.35271317829457366,91.0,258.0,2018,4.0
627,3,206,grado en ingenieria informatica-tecnologias informaticas,0.56,98.0,175.0,2018,4.0
628,23,207,grado en ingenieria mecanica,0.30386740331491713,55.0,181.0,2018,4.0
629,45,208,grado en ingenieria quimica,0.391304347826087,27.0,69.0,2018,4.0
630,23,209,grado en ingenieria quimica industrial,0.3185840707964602,36.0,113.0,2018,4.0
631,2,210,grado en periodismo,0.12318840579710146,34.0,276.0,2018,4.0
632,2,211,grado en publicidad y relaciones publicas,0.14492753623188406,20.0,138.0,2018,4.0
633,14,217,grado en biomedicina basica y experimental,0.24489795918367346,12.0,49.0,2018,4.0
634,20,218,grado en criminologia,0.21311475409836064,13.0,61.0,2018,4.0
635,12,219,grado en estudios de asia oriental por la us y la ude malaga,0.21568627450980393,11.0,51.0,2018,4.0
636,45,221,grado en ingenieria de la energia por la us y la u malaga,0.2537313432835821,17.0,67.0,2018,4.0
637,6,222,grado en ingenieria de materiales,0.21739130434782608,10.0,46.0,2018,4.0
638,19,223,grado en optica y optometria,0.11864406779661017,7.0,59.0,2018,4.0
639,5,224,grado en bioquimica por la u de sevilla y u de malaga,0.15789473684210525,9.0,57.0,2018,4.0
640,45,225,grado en ingenieria civil,0.3611111111111111,26.0,72.0,2018,4.0
641,3,226,grado en ingenieria de la salud por la u malaga y la usevilla,0.25,17.0,68.0,2018,4.0
642,45,227,grado en ingenieria de organizacion industrial por la u m y us,0.22535211267605634,16.0,71.0,2018,4.0
643,45,228,grado en ingenieria electronica robotica y mecatronica (uma-us),0.16666666666666666,11.0,66.0,2018,4.0
644,15,233,grado en fundamentos de arquitectura (13-14),0.23668639053254437,80.0,338.0,2018,4.0
645,4,242,grado en arqueologia por la u granada u jaen y u sevilla,0.3157894736842105,12.0,38.0,2018,4.0
646,98,244,grado en edificacion,0.0,0.0,19.0,2018,4.0
647,2,m036,mu en comunicacion y cultura (rd1393/07),0.11764705882352941,2.0,17.0,2018,4.0
648,302,m037,mu en artes del espectaculo vivo (rd1393/07),0.05,1.0,20.0,2018,4.0
649,302,m039,mu en estudios de genero y desarrollo profesional (rd07),0.08,2.0,25.0,2018,4.0
650,15,m040,mu en peritacion y reparacion de edificios,0.0,0.0,22.0,2018,4.0
651,13,m041,mu en psicologia de las organizaciones y del trabajo (07)_(16-17),0.06060606060606061,2.0,33.0,2018,4.0
652,15,m043,mu en urbanismo planeamiento y diseño urbano ,0.09523809523809523,2.0,21.0,2018,4.0
653,302,m044,mu profesorado de eso y bachillerato f p y ede idiomas ,0.019464720194647202,8.0,411.0,2018,1.0
654,18,m049,mu en actividad fisica y cdad de vida de perso adultas y mayo,0.06896551724137931,2.0,29.0,2018,1.0
655,4,m050,mu en arqueologia (rd1393/07),0.21428571428571427,3.0,14.0,2018,1.0
656,15,m051,mu en arquitectura y patrimonio historico (rd1393/07),0.024390243902439025,1.0,41.0,2018,1.0
657,21,m052,mu en arte: idea y produccion (rd1393/07),0.0,0.0,31.0,2018,1.0
658,302,m056,mu en ciencia y tecnologia de nuevos materiales (rd1393/07),0.0,0.0,11.0,2018,1.0
659,20,m061,mu en derecho constitucional (rd1393/07),0.23076923076923078,6.0,26.0,2018,1.0
660,20,m062,mu en derecho publico (rd1393/07),0.05555555555555555,1.0,18.0,2018,1.0
661,7,m063,mu en direccion y planificacion del turismo (rd1393/07),0.038461538461538464,1.0,26.0,2018,1.0
662,18,m064,mu en direccion evaluacion y calidad de las instituciones de for,0.10344827586206896,3.0,29.0,2018,1.0
663,4,m067,mu en documentos y libros archivos y bibliotecas ,0.02564102564102564,1.0,39.0,2018,1.0
664,1,m068,mu en economia y desarrollo (rd1393/07),0.09523809523809523,2.0,21.0,2018,1.0
665,16,m070,mu en endel español como l extranjera y de otras l modernas ,0.0,0.0,32.0,2018,
666,2,m071,mu en escritura creativa (rd1393/07),0.04,1.0,25.0,2018,
667,13,m073,mu en estudios avanzados en cerebro y conducta (16-17),0.0,0.0,26.0,2018,
668,22,m075,mu en estudios avanzados en quimica (rd1393/07),0.0,0.0,17.0,2018,
669,16,m076,mu en estudios hispanicos superiores (rd1393/07),0.08571428571428572,3.0,35.0,2018,
670,6,m082,mu en fisica nuclear (master interuniversitario) (rd1393/07),0.0,0.0,9.0,2018,
671,302,m083,mu en fisiologia y neurociencia (rd1393/07),0.12903225806451613,4.0,31.0,2018,
672,1,m085,mu en gestion estrategica y negocios internacionales ,0.10714285714285714,3.0,28.0,2018,
673,98,m086,mu en gestion integral de la edificacion (rd1393/07),0.07142857142857142,1.0,14.0,2018,
674,2,m088,mu en guion narrativa y creatividad audiovisual (rd1393/07),0.037037037037037035,1.0,27.0,2018,
675,13,m092,mu en intervencion y mediacion familiar (rd1393/07),0.0,0.0,30.0,2018,
676,3,m095,mu en logica computacion e inteligencia artificial ,0.32,8.0,25.0,2018,
677,6,m099,mu en microelectronica: dño y appsde sistemas m/nano,0.48,12.0,25.0,2018,
678,11,m100,mu en nuevas tendencias asistenciales en ciencias de la salud,0.06976744186046512,3.0,43.0,2018,
679,4,m103,mu en patrimonio artistico andaluz y su proy iberoamericana ,0.13333333333333333,4.0,30.0,2018,
680,13,m104,mu en psi de la edu avances en inter psicoedu y ne esp,0.0,0.0,34.0,2018,
681,13,m105,mu en psicologia de la intervencion social y comunitaria,0.0,0.0,35.0,2018,
682,20,m106,mu en relaciones juridico-privadas (rd1393/07),0.07142857142857142,1.0,14.0,2018,
683,98,m107,mu en seguridad integral en edificacion (rd1393/07),0.0,0.0,9.0,2018,
684,23,m108,mu en seguridad integral en la industria y prev rrll,0.09090909090909091,3.0,33.0,2018,
685,2,m114,mu en comunicacion institucional y politica (rd1393/2007),0.058823529411764705,2.0,34.0,2018,
686,12,m115,mu en filosofia y cultura moderna (rd1393/2007),0.08695652173913043,2.0,23.0,2018,
687,4,m117,mu en antropologia: gestion de la diver cul el patr y el des ,0.2608695652173913,6.0,23.0,2018,
688,4,m121,mu en estudios americanos (rd1393/2007),0.12903225806451613,4.0,31.0,2018,
689,20,m122,mu en abogacia (rd 1393/2007)(16-17),0.0125,1.0,80.0,2018,
690,20,m123,mu en asesoria juridico-mercantil fiscal y laboral ,0.0,0.0,22.0,2018,
691,8,m125,mu en consultoria laboral,0.08,2.0,25.0,2018,
692,14,m127,mu en investigacion medica: clinica y experimental ,0.0,0.0,29.0,2018,
693,13,m133,mu en migraciones internacionales salud y bienestar: modelos y estrategias de intervencion,0.125,3.0,24.0,2018,
694,19,m134,mu en especializacion profesional en farmacia,0.0967741935483871,3.0,31.0,2018,
695,4,m135,m u en estudios historicos avanzados,0.1111111111111111,4.0,36.0,2018,
696,5,m136,mu en biologia avanzada: investigacion y aplicacion,0.038461538461538464,1.0,26.0,2018,
697,16,m137,mu en estudios lingüisticos literarios y culturales por la us,0.022222222222222223,1.0,45.0,2018,
698,18,m138,mu en psicopedagogia,0.01818181818181818,1.0,55.0,2018,
699,18,m139,mu en neceducespecy atena la divad en la escuela por la us ,0.0,0.0,30.0,2018,
700,13,m141,mu en psicologia general sanitaria por la universidad de sevilla(16-17),0.02631578947368421,1.0,38.0,2018,
701,45,m142,mu en ingenieria de telecomunicacion por la u de sevilla (16-17),0.058823529411764705,1.0,17.0,2018,
702,45,m143,mu en ingenieria aeronautica por la universidad de sevilla (16-17),0.041666666666666664,3.0,72.0,2018,
703,45,m145,mu en ingenieria de caminos canales y puertos por la u s (16-17),0.25,9.0,36.0,2018,
704,45,m146,mu en ingenieria industrial por la universidad de sevilla (16-17),0.1,20.0,200.0,2018,
705,23,m148,mu en tecnologia e industria alimentaria por la us,0.07142857142857142,2.0,28.0,2018,
706,302,m149,mu en sist inteligentes en ener y transporte por la usy la um (16-17),0.0,0.0,4.0,2018,
707,9,m150,mu en ingenieria agronomica (16-17),0.03571428571428571,1.0,28.0,2018,
708,15,m153,mu en arquitectura ,0.08333333333333333,4.0,48.0,2018,
709,1,m154,mu en auditoria y contabilidad superior (16-17),0.041666666666666664,1.0,24.0,2018,
710,45,m155,mu en diseño avanzado en ingenieria mecanica ,0.35714285714285715,5.0,14.0,2018,
711,18,m156,mu en formacion y orientacion para el trabajo,0.038461538461538464,1.0,26.0,2018,
712,302,m157,mu genetica molecular y biotecnologia,0.03333333333333333,1.0,30.0,2018,
713,4,m158,m u en gestion del territorio instrumentos y tecnicas de intervenc ,0.1111111111111111,2.0,18.0,2018,
714,45,m160,mu en ingenieria electronica robotica y automatica ,0.14814814814814814,4.0,27.0,2018,
715,302,m161,mu en investigacion biomedica,0.05555555555555555,2.0,36.0,2018,
716,17,m162,mu en matematicas,0.2222222222222222,2.0,9.0,2018,
717,45,m163,mu en organizacion industrial y gestion de empresas ,0.13333333333333333,4.0,30.0,2018,
718,45,m164,mu en sistemas de energia electrica ,0.2608695652173913,6.0,23.0,2018,
719,45,m165,mu en sistemas de energia termica ,0.16666666666666666,1.0,6.0,2018,
720,15,m166,mu en ciudad y arquitectura sostenibles ,0.05555555555555555,1.0,18.0,2018,
721,10,m168,mu en odontologia medico-quirurgica e integral,0.0,0.0,10.0,2018,
722,15,m169,mu en innovacion en arquitectura: tecnologia y diseño ,0.08333333333333333,1.0,12.0,2018,
723,302,m171,mu en estudios europeos (2012) rd 1393/2007,0.05263157894736842,1.0,19.0,2018,
724,10,m172,mu en odontologia restauradora estetica y funcional,0.0,0.0,10.0,2018,
725,1,m174,mu en estudios avanzados en direccion de empresas,0.20689655172413793,6.0,29.0,2018,
726,16,m175,mu en traduccion e interculturalidad (rd1393/07),0.0625,2.0,32.0,2018,
727,26,526,grado en enfermeria,0.15,12.0,80.0,2018,
728,28,527,grado en enfermeria,0.19480519480519481,15.0,77.0,2018,
729,28,528,grado en finanzas y contabilidad,0.3125,10.0,32.0,2018,
730,28,529,grado en relaciones laborales y recursos humanos,0.25,5.0,20.0,2018,
731,148,531,grado en enfermeria,0.15254237288135594,9.0,59.0,2018,
732,38,532,grado en turismo,0.3333333333333333,6.0,18.0,2018,
733,38,537,grado en publicidad y relaciones publicas,0.26666666666666666,12.0,45.0,2018,
734,38,538,grado en periodismo,0.34782608695652173,16.0,46.0,2018,
735,38,539,grado en comunicacion audiovisual,0.22,11.0,50.0,2018,
736,28,541,grado en educacion primaria,0.14035087719298245,8.0,57.0,2018,
737,28,542,grado en fisioterapia,0.14864864864864866,11.0,74.0,2018,
738,28,544,grado en educacion infantil,0.046511627906976744,2.0,43.0,2018,
739,28,m547,mu en profesorado de eso bachiller fp y enseñanzas de idiomas  ,0.010869565217391304,1.0,92.0,2018,
740,1,151,grado en administracion y direccion de empresas,0.311284046692607,160.0,514.0,2017,4.0
741,5,153,grado en biologia,0.15,33.0,220.0,2017,4.0
742,18,154,grado en ciencias de la actividad fisica y del deporte,0.07936507936507936,5.0,63.0,2017,4.0
743,20,155,grado en derecho,0.15717092337917485,80.0,509.0,2017,4.0
744,1,156,grado en economia,0.3263888888888889,47.0,144.0,2017,4.0
745,11,157,grado en enfermeria,0.19246861924686193,46.0,239.0,2017,4.0
746,19,158,grado en farmacia (ingreso 12-13),0.16233766233766234,50.0,308.0,2017,4.0
747,16,159,grado en filologia hispanica,0.24545454545454545,27.0,110.0,2017,4.0
748,12,160,grado en filosofia,0.45054945054945056,41.0,91.0,2017,4.0
749,7,161,grado en finanzas y contabilidad,0.44776119402985076,210.0,469.0,2017,4.0
750,6,162,grado en fisica,0.32673267326732675,33.0,101.0,2017,4.0
751,11,163,grado en fisioterapia,0.2079207920792079,21.0,101.0,2017,4.0
752,4,164,grado en geografia y gestion del territorio,0.1935483870967742,12.0,62.0,2017,4.0
753,4,166,grado en historia,0.27717391304347827,51.0,184.0,2017,4.0
754,4,167,grado en historia del arte,0.43548387096774194,81.0,186.0,2017,4.0
755,17,171,grado en matematicas,0.3533834586466165,47.0,133.0,2017,4.0
756,14,172,grado en medicina (ingreso 11-12),0.10354223433242507,38.0,367.0,2017,4.0
757,10,173,grado en odontologia (ingreso 12-13),0.23655913978494625,22.0,93.0,2017,4.0
758,18,174,grado en pedagogia,0.14285714285714285,30.0,210.0,2017,4.0
759,11,175,grado en podologia,0.20588235294117646,14.0,68.0,2017,4.0
760,13,176,grado en psicologia,0.10452961672473868,30.0,287.0,2017,4.0
761,22,177,grado en quimica,0.22448979591836735,33.0,147.0,2017,4.0
762,8,178,grado en relaciones laborales y recursos humanos,0.20087336244541484,46.0,229.0,2017,4.0
763,7,179,grado en turismo,0.27976190476190477,94.0,336.0,2017,4.0
764,1,180,grado en marketing e investigacion de mercados,0.3106060606060606,41.0,132.0,2017,4.0
765,16,181,grado en estudios arabes e islamicos,0.5277777777777778,19.0,36.0,2017,4.0
766,16,182,grado en estudios franceses,0.4,28.0,70.0,2017,4.0
767,16,183,grado en estudios ingleses,0.3157894736842105,54.0,171.0,2017,4.0
768,16,184,grado en filologia clasica,0.6875,22.0,32.0,2017,4.0
769,16,185,grado en lengua y literatura alemanas,0.3,18.0,60.0,2017,4.0
770,4,188,grado en antropologia social y cultural,0.5,32.0,64.0,2017,4.0
771,21,190,grado en bellas artes,0.14444444444444443,26.0,180.0,2017,4.0
772,2,192,grado en comunicacion audiovisual,0.09219858156028368,13.0,141.0,2017,4.0
773,21,193,grado en conservacion y restauracion de bienes culturales,0.27419354838709675,17.0,62.0,2017,4.0
774,18,194,grado en educacion infantil,0.07142857142857142,17.0,238.0,2017,4.0
775,18,195,grado en educacion primaria,0.13070866141732285,83.0,635.0,2017,4.0
776,17,196,grado en estadistica,0.5098039215686274,26.0,51.0,2017,4.0
777,45,197,grado en ingenieria aeroespacial,0.16296296296296298,22.0,135.0,2017,4.0
778,9,198,grado en ingenieria agricola,0.4216417910447761,113.0,268.0,2017,4.0
779,45,199,grado en ingenieria de las tecnologias de telecomunicacion,0.34972677595628415,64.0,183.0,2017,4.0
780,23,200,grado en ingenieria electrica,0.29545454545454547,39.0,132.0,2017,4.0
781,23,201,grado en ingenieria electronica industrial,0.40437158469945356,74.0,183.0,2017,4.0
782,23,202,grado en ingenieria en diseño industrial y desarrollo del producto,0.3006993006993007,43.0,143.0,2017,4.0
783,45,203,grado en ingenieria de tecnologias industriales,0.16549295774647887,47.0,284.0,2017,4.0
784,3,204,grado en ingenieria informatica-ingenieria de computadores,0.6715328467153284,92.0,137.0,2017,4.0
785,3,205,grado en ingenieria informatica-ingenieria del software,0.32926829268292684,81.0,246.0,2017,4.0
786,3,206,grado en ingenieria informatica-tecnologias informaticas,0.581151832460733,111.0,191.0,2017,4.0
787,23,207,grado en ingenieria mecanica,0.22167487684729065,45.0,203.0,2017,4.0
788,45,208,grado en ingenieria quimica,0.35714285714285715,30.0,84.0,2017,4.0
789,23,209,grado en ingenieria quimica industrial,0.2833333333333333,34.0,120.0,2017,4.0
790,2,210,grado en periodismo,0.15412186379928317,43.0,279.0,2017,4.0
791,2,211,grado en publicidad y relaciones publicas,0.13138686131386862,18.0,137.0,2017,4.0
792,14,217,grado en biomedicina basica y experimental,0.2,10.0,50.0,2017,4.0
793,20,218,grado en criminologia,0.14545454545454545,8.0,55.0,2017,4.0
794,12,219,grado en estudios de asia oriental por la us y la ude malaga,0.20754716981132076,11.0,53.0,2017,4.0
795,45,221,grado en ingenieria de la energia por la us y la u malaga,0.21875,14.0,64.0,2017,4.0
796,6,222,grado en ingenieria de materiales,0.1891891891891892,7.0,37.0,2017,4.0
797,19,223,grado en optica y optometria,0.16666666666666666,9.0,54.0,2017,4.0
798,5,224,grado en bioquimica por la u de sevilla y u de malaga,0.11428571428571428,8.0,70.0,2017,4.0
799,45,225,grado en ingenieria civil,0.2911392405063291,23.0,79.0,2017,4.0
800,3,226,grado en ingenieria de la salud por la u malaga y la usevilla,0.23809523809523808,15.0,63.0,2017,4.0
801,45,227,grado en ingenieria de organizacion industrial por la u m y us,0.25757575757575757,17.0,66.0,2017,4.0
802,45,228,grado en ingenieria electronica robotica y mecatronica (uma-us),0.22058823529411764,15.0,68.0,2017,4.0
803,2,m036,mu en comunicacion y cultura (rd1393/07),0.15789473684210525,3.0,19.0,2017,4.0
804,302,m037,mu en artes del espectaculo vivo (rd1393/07),0.0625,1.0,16.0,2017,4.0
805,302,m039,mu en estudios de genero y desarrollo profesional (rd07),0.10344827586206896,3.0,29.0,2017,4.0
806,15,m040,mu en peritacion y reparacion de edificios,0.05263157894736842,1.0,19.0,2017,4.0
807,13,m041,mu en psicologia de las organizaciones y del trabajo (07),0.12903225806451613,4.0,31.0,2017,4.0
808,15,m043,mu en urbanismo planeamiento y diseño urbano ,0.05,1.0,20.0,2017,1.0
809,302,m044,mu profesorado de eso y bachillerato f p y ede idiomas ,0.03827751196172249,16.0,418.0,2017,1.0
810,302,m048,mu en gestion de las tec de la informacion y de las comu,0.0,0.0,14.0,2017,1.0
811,18,m049,mu en actividad fisica y cdad de vida de perso adultas y mayo,0.13333333333333333,2.0,15.0,2017,1.0
812,4,m050,mu en arqueologia (rd1393/07),0.1111111111111111,3.0,27.0,2017,1.0
813,15,m051,mu en arquitectura y patrimonio historico (rd1393/07),0.023809523809523808,1.0,42.0,2017,1.0
814,21,m052,mu en arte: idea y produccion (rd1393/07),0.15384615384615385,2.0,13.0,2017,1.0
815,302,m056,mu en ciencia y tecnologia de nuevos materiales (rd1393/07),0.21052631578947367,4.0,19.0,2017,2.0
816,1,m060,mu en consultoria economica y analisis aplicado (rd1393/07),0.0,0.0,23.0,2017,1.0
817,20,m061,mu en derecho constitucional (rd1393/07),0.15384615384615385,4.0,26.0,2017,1.0
818,20,m062,mu en derecho publico (rd1393/07),0.05263157894736842,1.0,19.0,2017,
819,7,m063,mu en direccion y planificacion del turismo (rd1393/07),0.06896551724137931,2.0,29.0,2017,
820,18,m064,mu en direccion evaluacion y calidad de las instituciones de for,0.2,4.0,20.0,2017,
821,4,m067,mu en documentos y libros archivos y bibliotecas ,0.0,0.0,35.0,2017,
822,1,m068,mu en economia y desarrollo (rd1393/07),0.25,2.0,8.0,2017,
823,16,m070,mu en endel español como l extranjera y de otras l modernas ,0.1891891891891892,7.0,37.0,2017,
824,2,m071,mu en escritura creativa (rd1393/07),0.2413793103448276,7.0,29.0,2017,
825,13,m073,mu en estudios avanzados en cerebro y conducta ,0.037037037037037035,1.0,27.0,2017,
826,22,m075,mu en estudios avanzados en quimica (rd1393/07),0.0,0.0,16.0,2017,
827,16,m076,mu en estudios hispanicos superiores (rd1393/07),0.058823529411764705,2.0,34.0,2017,
828,6,m082,mu en fisica nuclear (master interuniversitario) (rd1393/07),0.125,2.0,16.0,2017,
829,302,m083,mu en fisiologia y neurociencia (rd1393/07),0.15384615384615385,4.0,26.0,2017,
830,1,m085,mu en gestion estrategica y negocios internacionales ,0.07142857142857142,2.0,28.0,2017,
831,98,m086,mu en gestion integral de la edificacion (rd1393/07),0.07142857142857142,1.0,14.0,2017,
832,8,m087,mu en gestion y desarrollo de recursos humanos,0.16129032258064516,5.0,31.0,2017,
833,2,m088,mu en guion narrativa y creatividad audiovisual (rd1393/07),0.0,0.0,27.0,2017,
834,3,m090,mu en ingenieria y tecnologia del software,0.3333333333333333,5.0,15.0,2017,
835,13,m092,mu en intervencion y mediacion familiar (rd1393/07),0.1,3.0,30.0,2017,
836,3,m095,mu en logica computacion e inteligencia artificial ,0.17857142857142858,5.0,28.0,2017,
837,6,m099,mu en microelectronica: dño y appsde sistemas m/nano,0.2777777777777778,5.0,18.0,2017,
838,11,m100,mu en nuevas tendencias asistenciales en ciencias de la salud,0.09803921568627451,5.0,51.0,2017,
839,4,m103,mu en patrimonio artistico andaluz y su proy iberoamericana ,0.0,0.0,14.0,2017,
840,13,m104,mu en psi de la edu avances en inter psicoedu y ne esp,0.02857142857142857,1.0,35.0,2017,
841,13,m105,mu en psicologia de la intervencion social y comunitaria,0.05714285714285714,2.0,35.0,2017,
842,20,m106,mu en relaciones juridico-privadas (rd1393/07),0.0,0.0,10.0,2017,
843,98,m107,mu en seguridad integral en edificacion (rd1393/07),0.0,0.0,22.0,2017,
844,23,m108,mu en seguridad integral en la industria y prev rrll,0.058823529411764705,2.0,34.0,2017,
845,2,m114,mu en comunicacion institucional y politica (rd1393/2007),0.06060606060606061,2.0,33.0,2017,
846,12,m115,mu en filosofia y cultura moderna (rd1393/2007),0.12,3.0,25.0,2017,
847,4,m117,mu en antropologia: gestion de la diver cul el patr y el des ,0.09090909090909091,2.0,22.0,2017,
848,4,m121,mu en estudios americanos (rd1393/2007),0.06666666666666667,2.0,30.0,2017,
849,20,m122,mu en abogacia (rd 1393/2007),0.012048192771084338,1.0,83.0,2017,
850,20,m123,mu en asesoria juridico-mercantil fiscal y laboral ,0.03571428571428571,1.0,28.0,2017,
851,8,m125,mu en consultoria laboral,0.043478260869565216,1.0,23.0,2017,
852,14,m127,mu en investigacion medica: clinica y experimental ,0.11428571428571428,4.0,35.0,2017,
853,13,m133,mu en migraciones internacionales salud y bienestar: modelos y estrategias de intervencion,0.09523809523809523,2.0,21.0,2017,
854,19,m134,mu en especializacion profesional en farmacia,0.03333333333333333,1.0,30.0,2017,
855,4,m135,m u en estudios historicos avanzados,0.13157894736842105,5.0,38.0,2017,
856,5,m136,mu en biologia avanzada: investigacion y aplicacion,0.14285714285714285,4.0,28.0,2017,
857,16,m137,mu en estudios lingüisticos literarios y culturales por la us,0.11764705882352941,6.0,51.0,2017,
858,18,m138,mu en psicopedagogia,0.05172413793103448,3.0,58.0,2017,
859,18,m139,mu en neceducespecy atena la divad en la escuela por la us ,0.03571428571428571,1.0,28.0,2017,
860,13,m141,mu en psicologia general sanitaria por la universidad de sevilla,0.05128205128205128,2.0,39.0,2017,
861,45,m142,mu en ingenieria de telecomunicacion por la u de sevilla ,0.041666666666666664,1.0,24.0,2017,
862,45,m143,mu en ingenieria aeronautica por la universidad de sevilla ,0.025,1.0,40.0,2017,
863,45,m144,mu en ingenieria quimica por la universidad de sevilla,0.0,0.0,10.0,2017,
864,45,m145,mu en ingenieria de caminos canales y puertos por la u s,0.07142857142857142,3.0,42.0,2017,
865,45,m146,mu en ingenieria industrial por la universidad de sevilla,0.09615384615384616,15.0,156.0,2017,
866,3,m147,mu en ingenieria informatica,0.0,0.0,5.0,2017,
867,23,m148,mu en tecnologia e industria alimentaria por la us,0.08,2.0,25.0,2017,
868,302,m149,mu en sist inteligentes en ener y transporte por la usy la um,0.3333333333333333,3.0,9.0,2017,
869,9,m150,master universitario en ingenieria agronomica,0.045454545454545456,1.0,22.0,2017,
870,15,m153,mu en arquitectura ,0.0,0.0,37.0,2017,
871,1,m154,master universitario en auditoria y contabilidad superior,0.043478260869565216,1.0,23.0,2017,
872,45,m155,mu en diseño avanzado en ingenieria mecanica ,0.16666666666666666,2.0,12.0,2017,
873,18,m156,mu en formacion y orientacion para el trabajo,0.0,0.0,24.0,2017,
874,302,m157,master universitario genetica molecular y biotecnologia,0.0,0.0,30.0,2017,
875,4,m158,m u en gestion del territorio instrumentos y tecnicas de intervenc ,0.0,0.0,7.0,2017,
876,45,m159,mu en ingenieria ambiental,0.0,0.0,25.0,2017,
877,45,m160,mu en ingenieria electronica robotica y automatica ,0.24,6.0,25.0,2017,
878,302,m161,master universitario en investigacion biomedica,0.029411764705882353,1.0,34.0,2017,
879,17,m162,master universitario en matematicas,0.0,0.0,17.0,2017,
880,45,m163,mu en organizacion industrial y gestion de empresas ,0.10714285714285714,3.0,28.0,2017,
881,45,m164,mu en sistemas de energia electrica ,0.047619047619047616,1.0,21.0,2017,
882,45,m165,mu en sistemas de energia termica ,0.0,0.0,12.0,2017,
883,15,m166,mu en ciudad y arquitectura sostenibles ,0.10526315789473684,2.0,19.0,2017,
